,title,company_name,location,via,description,related_links,thumbnail,extensions,detected_extensions,job_id
0,Data Scientist,Opera,Poland,via Trabajo.org,"Weâre currently seeking data scientists to work on Opera products, help drive product and business decisions and to make our users happier

In our daily work we prepare systematic analyses, dashboards and ad hoc reports. We also develop ideas and create tools to automate the assessment of user satisfaction with Opera products. Beyond systematic and well-defined tasks, we look for less obvious ways to explore and assess the Opera ecosystem.

Responsibilities:

Designing and implementing data processing pipelines
Building dashboards and reports
Identifying, analyzing and interpreting trends and patterns in complex data sets
Developing prediction models using machine learning and statistical methods
Creating and performing tests, and analyzing data for useful insights

Minimum Qualifications:

Experience with quantitative analysis
Experience with building data processing pipelines
Solid understanding of statistical analysis
Experience communicating analysis results
Applied statistics or... experimentation (i.e. A/B testing) in real-life problems
Degree in either Math, Statistics, Computer Science, Physics, Engineering, or another technical field. Advanced degrees preferred
Experience in SQL and scripting language (Python)

Preferred Qualifications:

Experience working with large datasets in cloud-based analytics platforms like BigQuery or similar
Familiarity with Business Intelligence solutions like Looker or similar
Experience with e-commerce
Experience with an internet-based company

About us:

Opera is a global web innovator with an engaged and growing base of hundreds of millions of monthly active users who seek a better internet experience. Building on over 25 years of innovation that started with browser products, Opera is now leveraging its brand and highly engaged user base in order to expand its business into new segments. Today, Opera offers users around the world a range of products and services that include PC and mobile browsers, the newsreader Opera News, and apps dedicated to gaming, fintech, e-commerce and classifieds.

Opera is headquartered in Oslo, Norway with major offices in Poland, China, Estonia and Sweden, as well as a presence in many additional countries. Opera is listed on the Nasdaq stock exchange under the âOPRAâ ticker symbol","[{'link': 'https://press.opera.com/', 'text': 'press.opera.com'}, {'link': 'https://www.google.com/search?q=Opera&sa=X&ved=0ahUKEwiQze2mv5z8AhU6EVkFHWItAFQQmJACCN0K', 'text': 'See web results for Opera'}]",https://encrypted-tbn0.gstatic.com/images?q=tbn:ANd9GcRy7BDVLI1v0TTiEd_1-A9erQIeLXnbzmstT3FzCrk&s,"['13 hours ago', 'Full-time']","{'posted_at': '13 hours ago', 'schedule_type': 'Full-time'}",eyJqb2JfdGl0bGUiOiJEYXRhIFNjaWVudGlzdCIsImh0aWRvY2lkIjoiaVNFTEFjaFdjZU1BQUFBQUFBQUFBQT09IiwidXVsZSI6IncrQ0FJUUlDSUdVRzlzWVc1ayIsImZjIjoiRXVJQkNxSUJRVUYwVm14aVFsaFlZbmRMWVZaR1ZITmZZakExTlMwM1dEVlNWRTVHZUdoQ1RsSTFlRzFFTUVsdFlYQlFUMlprYzNsYVdXSTFRblpoWmxkTGNHMWthVkprUVhJdFNrMWliekJvYTBSd1VqYzNXV3BLYTB0WU1rdERZak10UzBNeE5UbEhUMlZJV2xWeFZtWjZlRlU1VWxaU1dVUjBWa0puUnkxTlYyaHFTRmhXUjE5emFtVlZUMVphWWxkaFlYSmhWM2RwTkdSQ05XTkVWVE5wYTJsSGVtOUJFaGQzTURaeldUbEVaazFpY1drMVRtOVFOSFJ4UVc5QlZSb2lRVVJWZVVWSFptVmxNa3RFTUcwd1N6RjZhVWwxVldKS1UyNXpVMUJLTTBneVVRIiwiZmN2IjoiMyIsImZjX2lkIjoiZmNfMSIsImFwcGx5X2xpbmsiOnsidGl0bGUiOiIubkZnMmVie2ZvbnQtd2VpZ2h0OjUwMH0uQmk2RGRje2ZvbnQtd2VpZ2h0OjUwMH1BcHBseSBvbiBUcmFiYWpvLm9yZyIsImxpbmsiOiJodHRwczovL3BsLnRyYWJham8ub3JnL3phd29kLTEzNTUtMjAyMjEyMjgtMmI0OTBjZmU3ODg1OWFhYmQ1NDhjNzc1YjlkYTNjZWI/dXRtX2NhbXBhaWduPWdvb2dsZV9qb2JzX2FwcGx5XHUwMDI2dXRtX3NvdXJjZT1nb29nbGVfam9ic19hcHBseVx1MDAyNnV0bV9tZWRpdW09b3JnYW5pYyJ9fQ==
1,Controlling Data Scientist in Central Team,Robert Bosch sp. z o.o. Oddział w Mirkowie,"Mirków, Poland",via The:Protocol,Controlling Data Scientist in Central Team,"[{'link': 'https://www.google.com/search?q=Robert+Bosch+sp.+z+o.o.+Oddzia%C5%82+w+Mirkowie&sa=X&ved=0ahUKEwiQze2mv5z8AhU6EVkFHWItAFQQmJACCIcL', 'text': 'See web results for Robert Bosch sp. z o.o. Oddział w Mirkowie'}]",,"['4 hours ago', 'Contractor']","{'posted_at': '4 hours ago', 'schedule_type': 'Contractor'}",eyJqb2JfdGl0bGUiOiJDb250cm9sbGluZyBEYXRhIFNjaWVudGlzdCBpbiBDZW50cmFsIFRlYW0iLCJodGlkb2NpZCI6ImhiTVM5cUZ0ZHBBQUFBQUFBQUFBQUE9PSIsInV1bGUiOiJ3K0NBSVFJQ0lHVUc5c1lXNWsiLCJmYyI6IkVyY0NDdmNCUVVGMFZteGlRMFZCTmpVM05VZGFVVVUzVDNselJWUm5SVkpTVm5oS2NuWm5ZMFphY2xGNlpVNVRUazFzZW1OdlkxcHNiRlpIV0dSQmJUWm5RWGhrVEc5WlNtZHNXbEpOVkV4VFlVUnZWR1UxTFZwbFRVSlJYM1JLZVdkd1lWWTRRbWt4WTNSSmRWUjRMVkJKVUUxWFlqbEJSamt4VDNsbFdHVXhVeTFOTkMxUVJ6Tm1aWGwxWWt4VVFUY3dTMmMxVEZremRVWnhkVUpWZGpSWlZHRTFWM2syZUdWdFlWQldNM2RITldwVVNWcElla3N3TmxoNFJVNVRValJYV0ZZd1gyaFlNRTlGWDFaNFVVdGZjbXd6VHpWWWFqaFdhV0pWWlRWTlFrbGlkbVpqVHpGb2IwUnBNbWt3V0cxbFNuTjVaMEZMU2pjd01CSVhkekEyYzFrNVJHWk5ZbkZwTlU1dlVEUjBjVUZ2UVZVYUlrRkVWWGxGUjJaNWVtMUNkbEZtZVRkSFdsUlhkamsxVWpOT1IyOWpObTkyUVVFIiwiZmN2IjoiMyIsImZjX2lkIjoiZmNfMyIsImFwcGx5X2xpbmsiOnsidGl0bGUiOiJBcHBseSBvbiBUaGU6UHJvdG9jb2wiLCJsaW5rIjoiaHR0cHM6Ly90aGVwcm90b2NvbC5pdC9zemN6ZWdvbHkvcHJhY2EvY29udHJvbGxpbmctZGF0YS1zY2llbnRpc3QtaW4tY2VudHJhbC10ZWFtLG9mZXJ0YSw4OWNmMDAwMC0wYmQyLTU2M2YtMDNjMy0wOGRhZThiZjFiZjc/dXRtX2NhbXBhaWduPWdvb2dsZV9qb2JzX2FwcGx5XHUwMDI2dXRtX3NvdXJjZT1nb29nbGVfam9ic19hcHBseVx1MDAyNnV0bV9tZWRpdW09b3JnYW5pYyJ9fQ==
2,Senior Data Scientist,BOEING,"Gdańsk, Poland",via Trabajo.org,"Job Description

At Boeing, we innovate and collaborate to make the world a better place. From the seabed to outer space, you can contribute to work that matters with a company where diversity, equity and inclusion are shared values. We’re committed to fostering an environment for every teammate that’s welcoming, respectful and inclusive, with great opportunity for professional growth. Find your future with us.

Boeing is the world's largest aerospace company and leading manufacturer of commercial jetliners, defense, space and security systems, and service provider of aftermarket support.

We are looking for an accomplished Senior Data Scientist to join our team in Gdansk, Poland. Candidates can work from our office in Gdansk or in hybrid mode.

This position will be joining a team of data analysts that support Human Resources and enterprise business leaders. This role will be partnering across multiple functions to lead research projects evaluating the impact of organizational... activities on employee engagement and business objectives.

The ideal candidate for this role would have:
• A passion for continuous learning, teaching and collaborating.
• Experience integrating both internal and external data in order to provide robust recommendations on how employee learning, attrition, retention, and engagement impacts business objectives.
• The ability to define, build and deploy artificial intelligence and machine learning solutions.
• Excellent communication skills that will enable them to work directly with stakeholders and business leaders to scope problems, explain results clearly and address any concerns in terms that can be understood by a non-technical community of stakeholders.

Position Responsibilities:
• Develop end-to-end artificial intelligence and machine learning solutions including data processing, feature & model development and production deployment with agility and scale.
• Lead and mentor small teams of data scientists in the design, development, and implementation of complex and challenging efforts in advanced analytics and machine learning.
• Partner with the enterprise business functions and collaborate across multiple teams including analytics, product management, and operations to solve problems and identify trends and opportunities.
• Have passion about working with large and complex unstructured and structured data sets.
• Lead and contribute to design, algorithm, and code reviews.
• Able to self-direct and succeed with minimal guidance.
• Strong communication and interpersonal skills. You should be able to work across functions and effectively present, recommend and communicate a position by demonstrating its value and tradeoffs.

Employer will not sponsor applicants for employment visa status.

Basic Qualifications (Required Skills/Experience):
• A technical bachelor's degree with 7+ years, or MS/MA degree with 4+ years of relevant work experience, or a relevant PhD degree. A relevant degree is defined as one in a quantitative field such as computer science, statistics, mathematics, operations research, bioinformatics, economics, computational biology, physics or chemistry.
• Significant programming experience in one or more of the following: Python, Java, SQL, R.
• 5+ years of experience in database management, programming, statistical modeling and/or machine learning (SQL, R, Python, JMP, Tableau, etc.)
• Industry work experience or academic research in applied Artificial Intelligence / Machine Learning including deep learning.
• Experience and success leading small teams of technical experts in the development of advanced analytics, machine learning, or software solutions.
• Work experience or relevant coursework in software engineering including work with databases (e.g., experience with SQL) and Linux systems.

Preferred Qualifications (Desired Skills/Experience):
• Masters or PhD Degree preferred.
• Experience and expertise building and implementing state-of-the-art computer vision models and pipelines.
• Experience and expertise building and implementing state-of-the-art graph neural networks and pipelines.
• Experience and expertise building and implementing state-of-the-art natural language processing models and pipelines
• 2+ years work experience or relevant coursework training machine learning models in a cloud computing environment such as: AWS, Google Cloud Platform, Microsoft Azure, etc.
• Experience working with analytics technology stacks; Azure, Google Cloud Platform (GCP), Teradata, etc.
• Good organizational, interpersonal, and problem solving skills
• Ability to adjust priorities to multiple demands and unanticipated events
• Highly motivated and must work well in a team environment
• The ability to communicate effectively, both verbally and in writing

Join us if you want to:
• Have flexible working hours.
• Enjoy additional paid days off for Winter break (December 24th-January 1st).
• Develop professional skills with our virtual learning tools and platforms (O’Reilly Learning, Degreed, Enterprise Mentoring, Communities of Excellence & Practice).
• Benefit from Employee Recognition Program.
• Get Medical Plan (Medicover) and life insurance (Warta S.A.) for you and your Family.
• Participate in Employee Pension Scheme (PPE).
• Enjoy and create with us friendly and inclusive atmosphere in workplace.
• Cooperate and exchange knowledge with international team where we support and respect each other.

Apply by sending your CV in English.

On Saturday, 12 March 2022, the President of the Republic of Poland signed a law to assist citizens of Ukraine in connection with the armed conflict in that country. As part of this law, Ukrainian refugees in Poland benefit from access to the Polish labour market. Boeing welcomes applications from Ukrainian refugees who are seeking employment in Poland.

Important information regarding this requisition:
This requisition is for a locally hired position in POLAND. Candidates must have current legal authorization to live and work in Poland. Benefits and pay are determined at the local level and are not part of Boeing U.S. based payroll.

Relocation:
This position does not offer relocation. Candidates must live in the immediate area or relocate at their own expense.

Export Control Requirements: Not an export control position

Equal Opportunity Employer:

We are an equal opportunity employer. We do not accept unlawful discrimination in our recruitment or employment practices on any grounds including but not limited to; color, religion, national origin, gender, sexual orientation, gender identity, age, physical or mental disability, genetic factors, military and veteran status, or other characteristics covered by applicable law.

We have teams in more than 65 countries, and each person plays a role in helping us become one of the world’s most innovative, diverse and inclusive companies. Applicants are encouraged to share with our recruitment team any accommodations required during the recruitment process","[{'link': 'http://www.boeing.com/', 'text': 'boeing.com'}, {'link': 'https://www.google.com/search?q=BOEING&sa=X&ved=0ahUKEwiQze2mv5z8AhU6EVkFHWItAFQQmJACCLUL', 'text': 'See web results for BOEING'}]",https://encrypted-tbn0.gstatic.com/images?q=tbn:ANd9GcRy7BDVLI1v0TTiEd_1-A9erQIeLXnbzmstT3FzCrk&s,"['8 hours ago', 'Full-time']","{'posted_at': '8 hours ago', 'schedule_type': 'Full-time'}",eyJqb2JfdGl0bGUiOiJTZW5pb3IgRGF0YSBTY2llbnRpc3QiLCJodGlkb2NpZCI6IjN4UWpOUWxFUkc0QUFBQUFBQUFBQUE9PSIsInV1bGUiOiJ3K0NBSVFJQ0lHVUc5c1lXNWsiLCJmYyI6IkV2Y0JDcmNCUVVGMFZteGlSRXRZUld0MmNEbGhWRWs1V0hwYVdGTTBZVFJ6UlVWUU1VNVdOMW95VEdzNUxUVnJUbU5PWld0dk0ycGlSbGg1U1hCd1dFTlZlRWt4YUZScGN6Qk5jRkJGZVVrdE1uYzBWWFZSWW14Nk9YVjFlQzB3TldNd2JGQkphbTQ0V1VWUE5XeExURU4xWTJsR1pFZERiVlZYYmpBNWRtbFpXRXRVWjIxa2NuQnJjQzE2U0dSaGFuZEhORkJHUmxCS1RrcGxUbU50TTNoR1ZqQTVUVkpDYm1aV2N6WnNkVnBYU2xBMlREZFJOMjVMTkU5ekVoZDNNRFp6V1RsRVprMWljV2sxVG05UU5IUnhRVzlCVlJvaVFVUlZlVVZIWm5Wd1NrRkRhazR6YkVsWVdtVmFjbXd3ZEhsemMyRnFVMk5WVVEiLCJmY3YiOiIzIiwiZmNfaWQiOiJmY180IiwiYXBwbHlfbGluayI6eyJ0aXRsZSI6IkFwcGx5IG9uIFRyYWJham8ub3JnIiwibGluayI6Imh0dHBzOi8vcGwudHJhYmFqby5vcmcvemF3b2QtMTkzNS0yMDIyMTIyOC1jMjQ4ZmRhMDY3NjljYzIxYzEzMjRkYWZlNjBmNDI1Yz91dG1fY2FtcGFpZ249Z29vZ2xlX2pvYnNfYXBwbHlcdTAwMjZ1dG1fc291cmNlPWdvb2dsZV9qb2JzX2FwcGx5XHUwMDI2dXRtX21lZGl1bT1vcmdhbmljIn19
3,Data Scientist Lead,NatWest Group,"Warsaw, Poland",via Trabajo.org,"Join us as a Data Scientist
• You’ll be identifying and working with large, complex data sets to solve difficult, non-routine analysis problems, applying advanced analytical methods as needed
• We’ll look to you to actively participate in the data community to identify and deliver opportunities to support the bank’s strategic direction through better use of data
• This is an opportunity to achieve excellent exposure in a challenging role and to make a real impact with your work 

What you'll do

As a Data Scientist, you’ll be evaluating and improving business processes and products using scientific rigour and statistical methods. You’ll be supporting and collaborating with multidisciplinary teams of data engineers and analysts on a wide range of business problems including the prevention of financial crime, understanding customer interactions with the bank and the management of credit risk.

You’ll also be:
• Developing and deepening your knowledge of data structures and metrics... advocating for changes where needed for product development
• Communicating effectively across the organisation to make business recommendations, gaining business buy-in to solutions tailored to customers' needs
• Conducting analysis that includes data gathering and requirements specification in collaboration with business stakeholders
• Iteratively building and prototyping data analysis pipelines to provide insights that will ultimately lead to production deployment
• Identifying new methods, tools, techniques and opportunities to deliver business value via cost reduction, income generation or improved customer experience through the application of data science

The skills you'll need

We’re recruiting for multiple roles across a range to levels, up to and including experienced Managers.

To succeed in these roles, you’ll need evidence of previous project implementation and work experience gained in a data analysis related field as part of a multidisciplinary team. Additionally, you’ll hold a degree in a quantitative discipline or have evidence of equivalent practical experience.

You'll have experience with Python and Scala based data science development using standard data science libraries and big data processing frameworks, as well as experience of the software development and DevOps life cycle and in using tools such as Git, TeamCity, and MLflow. You'll also ideally have experience of building MVP web applications such as Flask and Django.

You’ll also demonstrate:
• Extensive experience with data science software, database languages, big data technologies and cloud environments
• Experience articulating and translating business questions and using data science techniques, such as supervised and unsupervised ML, deep learning and graph based models, to arrive at an answer using available data
• Understanding (conceptual) of latest approaches (BERT, Transfer Learning etc.) 
• Experience designing and building end-to-end machine learning based pipelines
• The ability to demonstrate leadership, self-direction and a willingness to both teach others and learn new techniques
• Effective written and verbal communication skills and the ability to adapt the communication style to a specific audience
• Extensive relevant work experience, including expertise with statistical data analysis such as linear models, multivariate analysis, stochastic models and sampling methods
• Experience developing scalable, robust and production level code with Object oriented programming (OOP) concepts. 
• Experience working with Agile delivery process. 

Hours

40","[{'link': 'http://www.rbs.com/', 'text': 'rbs.com'}, {'link': 'https://www.google.com/search?q=NatWest+Group&sa=X&ved=0ahUKEwiQze2mv5z8AhU6EVkFHWItAFQQmJACCOML', 'text': 'See web results for NatWest Group'}]",https://encrypted-tbn0.gstatic.com/images?q=tbn:ANd9GcRy7BDVLI1v0TTiEd_1-A9erQIeLXnbzmstT3FzCrk&s,"['12 hours ago', 'Part-time']","{'posted_at': '12 hours ago', 'schedule_type': 'Part-time'}",eyJqb2JfdGl0bGUiOiJEYXRhIFNjaWVudGlzdCBMZWFkIiwiaHRpZG9jaWQiOiJQcXl3QzRXOExTTUFBQUFBQUFBQUFBPT0iLCJ1dWxlIjoidytDQUlRSUNJR1VHOXNZVzVrIiwiZmMiOiJFdmNCQ3JjQlFVRjBWbXhpUTNwcVUyTnBUVGx5T1hSVU1FaG5jVnB6VVMxSVJGRkNlbGhtVTBKNldXMU1VbkU0WjFsalpHTnhRa28zZWpodGJUWTNTSEZPVTNjelpqRlNibVJXWVRZemVYQlNiM0JTYlZJM1gwUnVZVVpWU214T2JtRndXbk56VTJoTFF6aFdhMlJIT0dJNVRHUTRkbDloU2pWWlRIWlRZVWhJUmt3dFJqZEZZM2cyVldoR1NIbFhZWFo0YkVOSVRFeHpjMWxYTkcxbWJ6WjRhVnBZUVZWR2RXTjFNRVpaY1Vaa09EZHRZVlYzY25wU2FXZHZFaGQzTURaeldUbEVaazFpY1drMVRtOVFOSFJ4UVc5QlZSb2lRVVJWZVVWSFpYbERiRmxqVnpSUFUyc3lMVzFzT0UwNWFUWklTVk5wVDNGNFp3IiwiZmN2IjoiMyIsImZjX2lkIjoiZmNfNiIsImFwcGx5X2xpbmsiOnsidGl0bGUiOiJBcHBseSBvbiBUcmFiYWpvLm9yZyIsImxpbmsiOiJodHRwczovL3BsLnRyYWJham8ub3JnL3phd29kLTEzNTUtMjAyMjEyMjgtYTE0OGQ1ZjJhODZiNGRhZDE4ZmU3ODc4NmQ4MDNjOGU/dXRtX2NhbXBhaWduPWdvb2dsZV9qb2JzX2FwcGx5XHUwMDI2dXRtX3NvdXJjZT1nb29nbGVfam9ic19hcHBseVx1MDAyNnV0bV9tZWRpdW09b3JnYW5pYyJ9fQ==
4,Data Science Manager - Instagram Creator Relevance,Instagram,Poland,via Karkidi,"Meta’s mission is to give people the power to build community and bring the world closer together through our family of apps and services. we're building a different kind of company that connects billions of people around the world, gives them ways to share what matters most to them, and helps bring people closer together. Whether we're creating new products or helping a small business expand its reach, people at Meta are builders at heart. Our global teams are constantly iterating, solving problems, and working together to empower people around the world to build community and connect in meaningful ways. Together, we can help people build stronger communities — we're just getting started. We're looking for analytics leaders to work on our core products with a passion for social media to help drive informed business decisions for Meta. You will enjoy working with cutting edge technology, and the ability to see your insights turned into real products on a regular basis. The perfect... candidate will have a background in a technical field, will have experience working with large data stores, and will have some experience building software. You will enjoy working with one of the richest data sets in the world, cutting edge technology, and the ability to see your insights turned into real products. You are scrappy, focused on results, a self-starter, and have demonstrated success in using analytics to drive the understanding, progression, and user engagement of a product. You have experience leading and growing a team of data scientists. You have a passion for mentoring members of your team to achieve strong results and continued engagement. The perfect candidate will have experience building and managing world-class analytics teams, will have worked with large and complex data, and will have a track record of driving data-informed decisions.

Responsibilities
• Help build and lead a great data science team to deliver world-class products
• Apply your expertise in quantitative analysis, data mining, and the presentation of data to see beyond the numbers and understand how our users interact with our core products
• Partner with Product and Engineering teams to solve problems and identify trends and opportunities Inform, influence, support, and execute our product decisions
• Manage development of data resources, gather requirements, organize sources, and support product launches while keeping the team accountable and impactful
• Recruit and develop teams of experienced data scientists

Minimum Qualifications
• 5+ years of experience managing high performers in a formal capacity
• Experience in quantitative analysis at a technology company, consulting, investment banking, or product management including experience with SQL or other programming languages. ML expertise strongly preferred.
• Experience communicating and representing results of analysis to senior leadership
• Experience initiating and driving projects to completion with minimal guidance.
• Experience with applied statistics or experimentation (i.e. A/B testing) in an industry setting

Preferred Qualifications
• Experience with large data sets and distributed computing (Hive/Hadoop).
• Understanding of statistical analysis, experience with packages, such as R, MATLAB, SPSS, SAS, Stata, etc.
• Bachelor Degree in Computer Science, Math, Physics, Engineering, or related quantitative field","[{'link': 'https://www.google.com/search?q=Instagram&sa=X&ved=0ahUKEwiQze2mv5z8AhU6EVkFHWItAFQQmJACCI8M', 'text': 'See web results for Instagram'}]",https://encrypted-tbn0.gstatic.com/images?q=tbn:ANd9GcSkMfDEwAlUynigyWZ8vQeZmf4HDvudTFpi-WA12YM&s,"['14 hours ago', 'Full-time']","{'posted_at': '14 hours ago', 'schedule_type': 'Full-time'}",eyJqb2JfdGl0bGUiOiJEYXRhIFNjaWVuY2UgTWFuYWdlciAtIEluc3RhZ3JhbSBDcmVhdG9yIFJlbGV2YW5jZSIsImh0aWRvY2lkIjoiXzhCeVhoVE9McWtBQUFBQUFBQUFBQT09IiwidXVsZSI6IncrQ0FJUUlDSUdVRzlzWVc1ayIsImZjIjoiRW93Q0Nzd0JRVUYwVm14aVFYZzNOa3h3TVhscVNISXhSVkZtWDBsYU4yVTVaMXB6VDJ0VFNYRkNNakJFU1RoM1oyTm9OREUzU2toVmJWbFJRVEZDY1hwMFNUSjRZWGhuVVdOcE1HMU9iVVF5UjJJd1RIbERZVVpDV2psdFVFcHdZbXBZTVc5cE5sVllNVGQ2VUhRM1JqWTVjbWh0VUY5V1MyNU5RMkp1Wmt0blRXMUtia001V0hwR2MwNWxVSFZTZDJZNFdHbGplalo0UWs0dGNubzVVRWg2U0RSTmEyTk5Za2h3ZVdwSWNXTTVVREF0ZVU5dFJVSk5hVkZFTlZsVVQybGpWSGcyYlhkWFozbE9OVzltTUdZMkVoZDNNRFp6V1RsRVprMWljV2sxVG05UU5IUnhRVzlCVlJvaVFVUlZlVVZIWlRSeVQyOUxOekpJTWtwU1JXZFRjelJKVVdFeGFsazNaM0UxVVEiLCJmY3YiOiIzIiwiZmNfaWQiOiJmY184IiwiYXBwbHlfbGluayI6eyJ0aXRsZSI6IkFwcGx5IG9uIEthcmtpZGkiLCJsaW5rIjoiaHR0cHM6Ly93d3cua2Fya2lkaS5jb20vam9iLWRldGFpbHMvMzQ1NDgtZGF0YS1zY2llbmNlLW1hbmFnZXItaW5zdGFncmFtLWNyZWF0b3ItcmVsZXZhbmNlLWpvYj91dG1fY2FtcGFpZ249Z29vZ2xlX2pvYnNfYXBwbHlcdTAwMjZ1dG1fc291cmNlPWdvb2dsZV9qb2JzX2FwcGx5XHUwMDI2dXRtX21lZGl1bT1vcmdhbmljIn19
